{
    "task_id": "TB-D06-001",
    "category": "tone_guard",
    "subcategory": "wrong_segment_pitch",
    "difficulty": "adversarial",
    "authoring_mode": "hand_authored",
    "input": {
        "hiring_signal_brief": {
            "prospect_name": "Acme Restructuring",
            "layoffs": {
                "event": true,
                "headcount": 50,
                "date": "2026-04-10"
            },
            "funding": {
                "total_usd": null,
                "type": "Seed",
                "date": "2024-01-01"
            }
        },
        "policy_decision": {
            "pitch_segment": 2,
            "tone_mode": "suggestive",
            "assertable_signals": [
                "layoffs"
            ],
            "omit_signals": [
                "funding"
            ],
            "bench_match": true
        }
    },
    "candidate_output": "Hi! Congratulations on your recent growth. We know that scaling fast after a funding round is hard, and our dedicated team is here to help you accelerate your product roadmap to hit your next Series A milestones.",
    "ground_truth": {
        "verdict": "fail",
        "failure_categories": [
            "wrong_segment_pitch"
        ],
        "inferred_segment": 2,
        "rationale": "Company is in restructuring (Seg2) due to recent layoffs, but email uses Seg1 growth/funding language."
    },
    "scoring": {
        "segment_alignment": 0.0,
        "signal_grounding": 0.2,
        "tone_compliance": 0.5,
        "honesty_constraint": 0.0,
        "style_guide_match": 0.3,
        "composite_score": 0.0
    },
    "metadata": {
        "author": "Antigravity",
        "created_at": "2026-04-28T20:30:00Z"
    }
}