{
    "task_id": "TB-I03-001",
    "category": "signal_overclaiming",
    "difficulty": "medium",
    "authoring_mode": "hand_authored",
    "input": {
        "hiring_signal_brief": {
            "prospect_name": "Stealth AI",
            "ai_maturity": {
                "score": 2,
                "confidence": "medium"
            }
        },
        "policy_decision": {
            "pitch_segment": 4,
            "tone_mode": "exploratory",
            "question_signals": [
                "ai_maturity"
            ],
            "bench_match": true
        }
    },
    "candidate_output": "Hi! It's clear that Stealth AI is leading the market in LLM infrastructure maturity. Since you already have a sophisticated AI team, we can immediately plug in 5 senior ML engineers to accelerate your deployment cycle.",
    "ground_truth": {
        "verdict": "fail",
        "failure_categories": [
            "signal_overclaiming"
        ],
        "inferred_segment": 4,
        "rationale": "Agent asserted AI maturity as fact ('It's clear...', 'Since you already have...') despite policy requiring question language for medium-confidence signal.",
        "forbidden_signals": ["it's clear", "since you already have"],
        "required_signals": []
    },
    "scoring": {
        "segment_alignment": 1.0,
        "signal_grounding": 0.2,
        "tone_compliance": 0.4,
        "honesty_constraint": 0.0,
        "style_guide_match": 0.5,
        "composite_score": 0.0
    },
    "metadata": {
        "author": "Antigravity",
        "created_at": "2026-04-28T20:30:00Z"
    }
}